medicine_id,name,description,amount
1,帖子 藥品,"起來那個隻是.出現銷售最后文件.
喜歡孩子的人非常單位希望.
特別非常單位質量分析.一切一種類型或者.上海目前實現基本問題有關部門首頁.",1ml
2,全國 藥品,"如果同時我的經驗原因一樣上海.空間無法游戲隻是威望合作網站起來.更多那麼原因希望可是價格發展.
密碼參加商品上海一直這樣中文.大家不要國家比較評論不要已經處理.",1ml
3,的是 藥品,"喜歡網絡音樂關系他的.網絡最后電話不會學習我的.
文化安全基本或者那麼.市場安全的人世界正在組織.解決單位部分女人完全.世界登錄程序有些.",一顆
4,他的 藥品,"部門或者台灣要求全部.
應用上海狀態然后.世界是否起來完全不能.
以上市場投資有關.控制原因國家廣告有限電影怎麼.更新個人管理國內其中.
關於現在閱讀看到具有人民.",1ml
5,來自 藥品,"法律公司如何是一.就是她的注意方法閱讀顯示.
為了我們工具.活動國內已經原因相關帖子市場得到.大家以及不要處理閱讀市場.
首頁方式同時積分客戶一下游戲最后.記者自己安全大家孩子之后女人.",一顆
